{
  "$defs": {
    "appColor": {
      "maxLength": 128,
      "pattern": "^(#[0-9a-fA-F]{3,8}|[a-zA-Z]{3,20}|(rgb|rgba|hsl|hsla|oklch|oklab|lab|lch|color)\\([0-9a-zA-Z.,%/ +-]*\\))$",
      "type": "string"
    },
    "syntaxStyle": {
      "oneOf": [
        {
          "$ref": "#/$defs/appColor"
        },
        {
          "additionalProperties": false,
          "minProperties": 1,
          "properties": {
            "bold": {
              "type": "boolean"
            },
            "color": {
              "$ref": "#/$defs/appColor"
            },
            "italic": {
              "type": "boolean"
            },
            "strikethrough": {
              "type": "boolean"
            },
            "underline": {
              "type": "boolean"
            }
          },
          "type": "object"
        }
      ]
    },
    "terminalColor": {
      "maxLength": 128,
      "pattern": "^#[0-9a-fA-F]{3,8}$",
      "type": "string"
    }
  },
  "$id": "https://raw.githubusercontent.com/omartelo/lich/main/themes/lich-theme.schema.json",
  "$schema": "https://json-schema.org/draft/2020-12/schema",
  "additionalProperties": false,
  "description": "A color theme for lich.",
  "properties": {
    "$schema": {
      "type": "string"
    },
    "app": {
      "additionalProperties": false,
      "properties": {
        "accent": {
          "$ref": "#/$defs/appColor"
        },
        "accent-foreground": {
          "$ref": "#/$defs/appColor"
        },
        "background": {
          "$ref": "#/$defs/appColor"
        },
        "border": {
          "$ref": "#/$defs/appColor"
        },
        "card": {
          "$ref": "#/$defs/appColor"
        },
        "card-foreground": {
          "$ref": "#/$defs/appColor"
        },
        "chart-1": {
          "$ref": "#/$defs/appColor"
        },
        "chart-2": {
          "$ref": "#/$defs/appColor"
        },
        "chart-3": {
          "$ref": "#/$defs/appColor"
        },
        "chart-4": {
          "$ref": "#/$defs/appColor"
        },
        "chart-5": {
          "$ref": "#/$defs/appColor"
        },
        "destructive": {
          "$ref": "#/$defs/appColor"
        },
        "foreground": {
          "$ref": "#/$defs/appColor"
        },
        "input": {
          "$ref": "#/$defs/appColor"
        },
        "muted": {
          "$ref": "#/$defs/appColor"
        },
        "muted-foreground": {
          "$ref": "#/$defs/appColor"
        },
        "popover": {
          "$ref": "#/$defs/appColor"
        },
        "popover-foreground": {
          "$ref": "#/$defs/appColor"
        },
        "primary": {
          "$ref": "#/$defs/appColor"
        },
        "primary-foreground": {
          "$ref": "#/$defs/appColor"
        },
        "ring": {
          "$ref": "#/$defs/appColor"
        },
        "secondary": {
          "$ref": "#/$defs/appColor"
        },
        "secondary-foreground": {
          "$ref": "#/$defs/appColor"
        },
        "sidebar": {
          "$ref": "#/$defs/appColor"
        },
        "sidebar-accent": {
          "$ref": "#/$defs/appColor"
        },
        "sidebar-accent-foreground": {
          "$ref": "#/$defs/appColor"
        },
        "sidebar-border": {
          "$ref": "#/$defs/appColor"
        },
        "sidebar-foreground": {
          "$ref": "#/$defs/appColor"
        },
        "sidebar-primary": {
          "$ref": "#/$defs/appColor"
        },
        "sidebar-primary-foreground": {
          "$ref": "#/$defs/appColor"
        },
        "sidebar-ring": {
          "$ref": "#/$defs/appColor"
        },
        "tone-pass": {
          "$ref": "#/$defs/appColor"
        },
        "tone-wait": {
          "$ref": "#/$defs/appColor"
        }
      },
      "required": [
        "accent",
        "accent-foreground",
        "background",
        "border",
        "card",
        "card-foreground",
        "chart-1",
        "chart-2",
        "chart-3",
        "chart-4",
        "chart-5",
        "destructive",
        "foreground",
        "input",
        "muted",
        "muted-foreground",
        "popover",
        "popover-foreground",
        "primary",
        "primary-foreground",
        "ring",
        "secondary",
        "secondary-foreground",
        "sidebar",
        "sidebar-accent",
        "sidebar-accent-foreground",
        "sidebar-border",
        "sidebar-foreground",
        "sidebar-primary",
        "sidebar-primary-foreground",
        "sidebar-ring",
        "tone-pass",
        "tone-wait"
      ],
      "type": "object"
    },
    "formatVersion": {
      "description": "The theme file format. Omitted means 1; lich refuses a format newer than it reads.",
      "maximum": 1,
      "minimum": 1,
      "type": "integer"
    },
    "id": {
      "description": "Names the file the theme is stored as, so reserved ids and Windows device names are out.",
      "maxLength": 64,
      "not": {
        "enum": [
          "aux",
          "com1",
          "com2",
          "com3",
          "com4",
          "com5",
          "com6",
          "com7",
          "com8",
          "com9",
          "con",
          "dark",
          "light",
          "lpt1",
          "lpt2",
          "lpt3",
          "lpt4",
          "lpt5",
          "lpt6",
          "lpt7",
          "lpt8",
          "lpt9",
          "match",
          "nul",
          "prn",
          "system"
        ]
      },
      "pattern": "^[a-z0-9][a-z0-9._-]{0,63}$",
      "type": "string"
    },
    "name": {
      "maxLength": 128,
      "pattern": "\\S",
      "type": "string"
    },
    "origin": {
      "description": "Written by lich on import; a hand-written value is ignored.",
      "enum": [
        "bundled",
        "custom"
      ]
    },
    "pair": {
      "description": "The id of this theme's variant for the other scheme, drawn while the OS asks for that scheme and following it is on. lich lists a theme whose pair has the same scheme as broken.",
      "maxLength": 64,
      "pattern": "^[a-z0-9][a-z0-9._-]{0,63}$",
      "type": "string"
    },
    "scheme": {
      "enum": [
        "light",
        "dark"
      ]
    },
    "source": {
      "additionalProperties": false,
      "description": "Written by lich for a theme installed from a repository.",
      "properties": {
        "url": {
          "type": "string"
        },
        "version": {
          "pattern": "^v?\\d+\\.\\d+\\.\\d+$",
          "type": "string"
        }
      },
      "required": [
        "url",
        "version"
      ],
      "type": "object"
    },
    "syntax": {
      "additionalProperties": {
        "$ref": "#/$defs/syntaxStyle"
      },
      "description": "Syntax highlighting by CodeMirror highlighting tag, as in \"keyword\" or \"function(variableName)\". The native window reads it; the web window ignores it.",
      "propertyNames": {
        "pattern": "^([a-z]+\\()*[a-zA-Z]+\\)*$"
      },
      "type": "object"
    },
    "terminal": {
      "additionalProperties": false,
      "properties": {
        "background": {
          "$ref": "#/$defs/terminalColor"
        },
        "black": {
          "$ref": "#/$defs/terminalColor"
        },
        "blue": {
          "$ref": "#/$defs/terminalColor"
        },
        "brightBlack": {
          "$ref": "#/$defs/terminalColor"
        },
        "brightBlue": {
          "$ref": "#/$defs/terminalColor"
        },
        "brightCyan": {
          "$ref": "#/$defs/terminalColor"
        },
        "brightGreen": {
          "$ref": "#/$defs/terminalColor"
        },
        "brightMagenta": {
          "$ref": "#/$defs/terminalColor"
        },
        "brightRed": {
          "$ref": "#/$defs/terminalColor"
        },
        "brightWhite": {
          "$ref": "#/$defs/terminalColor"
        },
        "brightYellow": {
          "$ref": "#/$defs/terminalColor"
        },
        "cursor": {
          "$ref": "#/$defs/terminalColor"
        },
        "cursorAccent": {
          "$ref": "#/$defs/terminalColor"
        },
        "cyan": {
          "$ref": "#/$defs/terminalColor"
        },
        "foreground": {
          "$ref": "#/$defs/terminalColor"
        },
        "green": {
          "$ref": "#/$defs/terminalColor"
        },
        "magenta": {
          "$ref": "#/$defs/terminalColor"
        },
        "red": {
          "$ref": "#/$defs/terminalColor"
        },
        "selectionBackground": {
          "$ref": "#/$defs/terminalColor"
        },
        "selectionForeground": {
          "$ref": "#/$defs/terminalColor"
        },
        "white": {
          "$ref": "#/$defs/terminalColor"
        },
        "yellow": {
          "$ref": "#/$defs/terminalColor"
        }
      },
      "required": [
        "background",
        "foreground"
      ],
      "type": "object"
    }
  },
  "required": [
    "id",
    "name",
    "scheme",
    "app",
    "terminal"
  ],
  "title": "lich theme",
  "type": "object"
}
