{
  "id": "dark",
  "name": "Dark",
  "scheme": "dark",
  "origin": "bundled",
  "app": {
    "background": "oklch(0.141 0.005 285.823)",
    "foreground": "oklch(0.985 0 0)",
    "card": "oklch(0.21 0.006 285.885)",
    "card-foreground": "oklch(0.985 0 0)",
    "popover": "oklch(0.21 0.006 285.885)",
    "popover-foreground": "oklch(0.985 0 0)",
    "primary": "oklch(0.92 0.004 286.32)",
    "primary-foreground": "oklch(0.21 0.006 285.885)",
    "secondary": "oklch(0.274 0.006 286.033)",
    "secondary-foreground": "oklch(0.985 0 0)",
    "muted": "oklch(0.274 0.006 286.033)",
    "muted-foreground": "oklch(0.705 0.015 286.067)",
    "accent": "oklch(0.274 0.006 286.033)",
    "accent-foreground": "oklch(0.985 0 0)",
    "destructive": "oklch(0.704 0.191 22.216)",
    "tone-pass": "oklch(0.696 0.17 162.48)",
    "tone-wait": "oklch(0.769 0.188 70.08)",
    "border": "oklch(1 0 0 / 10%)",
    "input": "oklch(1 0 0 / 15%)",
    "ring": "oklch(0.552 0.016 285.938)",
    "chart-1": "oklch(0.871 0.006 286.286)",
    "chart-2": "oklch(0.552 0.016 285.938)",
    "chart-3": "oklch(0.442 0.017 285.786)",
    "chart-4": "oklch(0.37 0.013 285.805)",
    "chart-5": "oklch(0.274 0.006 286.033)",
    "sidebar": "oklch(0.21 0.006 285.885)",
    "sidebar-foreground": "oklch(0.985 0 0)",
    "sidebar-primary": "oklch(0.488 0.243 264.376)",
    "sidebar-primary-foreground": "oklch(0.985 0 0)",
    "sidebar-accent": "oklch(0.274 0.006 286.033)",
    "sidebar-accent-foreground": "oklch(0.985 0 0)",
    "sidebar-border": "oklch(1 0 0 / 10%)",
    "sidebar-ring": "oklch(0.552 0.016 285.938)"
  },
  "terminal": {
    "background": "#06070f",
    "foreground": "#e5e7eb"
  },
  "syntax": {
    "keyword": "#c396f5",
    "string": "#82cb92",
    "regexp": "#82cb92",
    "escape": "#82cb92",
    "special(string)": "#82cb92",
    "comment": {
      "color": "#9f9fa9",
      "italic": true
    },
    "processingInstruction": {
      "color": "#9f9fa9",
      "italic": true
    },
    "literal": "#eca760",
    "number": "#eca760",
    "bool": "#eca760",
    "null": "#eca760",
    "atom": "#eca760",
    "typeName": "#71d0d5",
    "className": "#71d0d5",
    "namespace": "#71d0d5",
    "propertyName": "#82b1ed",
    "tagName": "#82b1ed",
    "function(variableName)": "#82b1ed",
    "punctuation": "#9f9fa9",
    "operator": "#9f9fa9",
    "operatorKeyword": "#9f9fa9",
    "invalid": "#ff6467",
    "strong": {
      "bold": true
    },
    "heading": {
      "bold": true
    },
    "emphasis": {
      "italic": true
    },
    "link": {
      "underline": true
    },
    "strikethrough": {
      "strikethrough": true
    }
  }
}
