{
  "id": "light",
  "name": "Light",
  "scheme": "light",
  "origin": "bundled",
  "pair": "dark",
  "app": {
    "background": "oklch(0.94 0.003 286.32)",
    "foreground": "oklch(0.21 0.006 285.885)",
    "card": "oklch(0.98 0.002 286.32)",
    "card-foreground": "oklch(0.21 0.006 285.885)",
    "popover": "oklch(0.98 0.002 286.32)",
    "popover-foreground": "oklch(0.21 0.006 285.885)",
    "primary": "oklch(0.21 0.006 285.885)",
    "primary-foreground": "oklch(0.985 0 0)",
    "secondary": "oklch(0.92 0.003 286.32)",
    "secondary-foreground": "oklch(0.21 0.006 285.885)",
    "muted": "oklch(0.935 0.003 286.32)",
    "muted-foreground": "oklch(0.505 0.016 285.938)",
    "accent": "oklch(0.9 0.004 286.32)",
    "accent-foreground": "oklch(0.21 0.006 285.885)",
    "destructive": "oklch(0.577 0.245 27.325)",
    "tone-pass": "oklch(0.508 0.118 165.612)",
    "tone-wait": "oklch(0.555 0.163 48.998)",
    "border": "oklch(0.888 0.004 286.32)",
    "input": "oklch(0.888 0.004 286.32)",
    "ring": "oklch(0.6 0.015 286.067)",
    "chart-1": "oklch(0.871 0.006 286.286)",
    "chart-2": "oklch(0.552 0.016 285.938)",
    "chart-3": "oklch(0.442 0.017 285.786)",
    "chart-4": "oklch(0.37 0.013 285.805)",
    "chart-5": "oklch(0.274 0.006 286.033)",
    "sidebar": "oklch(0.98 0.002 286.32)",
    "sidebar-foreground": "oklch(0.21 0.006 285.885)",
    "sidebar-primary": "oklch(0.21 0.006 285.885)",
    "sidebar-primary-foreground": "oklch(0.985 0 0)",
    "sidebar-accent": "oklch(0.9 0.004 286.32)",
    "sidebar-accent-foreground": "oklch(0.21 0.006 285.885)",
    "sidebar-border": "oklch(0.888 0.004 286.32)",
    "sidebar-ring": "oklch(0.6 0.015 286.067)"
  },
  "terminal": {
    "background": "#e8e8ea",
    "foreground": "#1f2328",
    "black": "#24292f",
    "red": "#b33437",
    "green": "#1a6b32",
    "yellow": "#806000",
    "blue": "#174ba0",
    "magenta": "#8c3183",
    "cyan": "#126a6f",
    "white": "#4e5863",
    "brightBlack": "#3f4852",
    "brightRed": "#ba3439",
    "brightGreen": "#21753a",
    "brightYellow": "#826100",
    "brightBlue": "#2359af",
    "brightMagenta": "#9b4291",
    "brightCyan": "#16717a",
    "brightWhite": "#5f6974"
  },
  "syntax": {
    "keyword": "#8c3183",
    "string": "#1a6b32",
    "regexp": "#1a6b32",
    "escape": "#1a6b32",
    "special(string)": "#1a6b32",
    "comment": {
      "color": "#59636e",
      "italic": true
    },
    "processingInstruction": {
      "color": "#59636e",
      "italic": true
    },
    "literal": "#806000",
    "number": "#806000",
    "bool": "#806000",
    "null": "#806000",
    "atom": "#806000",
    "typeName": "#126a6f",
    "className": "#126a6f",
    "namespace": "#126a6f",
    "standard(variableName)": "#126a6f",
    "propertyName": "#174ba0",
    "tagName": "#174ba0",
    "function(variableName)": "#174ba0",
    "definition(local(variableName))": {
      "italic": true
    },
    "punctuation": "#59636e",
    "operator": "#59636e",
    "operatorKeyword": "#59636e",
    "invalid": "#b33437",
    "strong": {
      "bold": true
    },
    "heading": {
      "bold": true
    },
    "emphasis": {
      "italic": true
    },
    "link": {
      "underline": true
    },
    "strikethrough": {
      "strikethrough": true
    }
  }
}
