{
  "$schema": "https://raw.githubusercontent.com/omartelo/lich/main/themes/lich-theme.schema.json",
  "id": "purple-night",
  "name": "Purple Night",
  "scheme": "dark",
  "pair": "purple-day",
  "app": {
    "background": "#15111f",
    "foreground": "#f4efff",
    "card": "#1f1930",
    "card-foreground": "#f4efff",
    "popover": "#241d38",
    "popover-foreground": "#f4efff",
    "primary": "#b794f6",
    "primary-foreground": "#15111f",
    "secondary": "#2d2442",
    "secondary-foreground": "#efe7ff",
    "muted": "#261f36",
    "muted-foreground": "#b8a9d9",
    "accent": "#3a2d57",
    "accent-foreground": "#f4efff",
    "destructive": "#ff5c8a",
    "tone-pass": "oklch(0.696 0.17 162.48)",
    "tone-wait": "oklch(0.769 0.188 70.08)",
    "border": "#4a3a68",
    "input": "#554178",
    "ring": "#c4a7ff",
    "chart-1": "#b794f6",
    "chart-2": "#8be9fd",
    "chart-3": "#50fa7b",
    "chart-4": "#ffb86c",
    "chart-5": "#ff79c6",
    "sidebar": "#1b1628",
    "sidebar-foreground": "#f4efff",
    "sidebar-primary": "#b794f6",
    "sidebar-primary-foreground": "#15111f",
    "sidebar-accent": "#2d2442",
    "sidebar-accent-foreground": "#f4efff",
    "sidebar-border": "#4a3a68",
    "sidebar-ring": "#c4a7ff"
  },
  "terminal": {
    "background": "#15111f",
    "foreground": "#f4efff",
    "cursor": "#c4a7ff",
    "cursorAccent": "#15111f",
    "selectionBackground": "#4a3a68",
    "selectionForeground": "#ffffff",
    "black": "#15111f",
    "red": "#ff5c8a",
    "green": "#50fa7b",
    "yellow": "#ffb86c",
    "blue": "#8be9fd",
    "magenta": "#bd93f9",
    "cyan": "#80ffea",
    "white": "#f4efff",
    "brightBlack": "#6f5a95",
    "brightRed": "#ff7aa8",
    "brightGreen": "#69ff94",
    "brightYellow": "#ffd18a",
    "brightBlue": "#a4f0ff",
    "brightMagenta": "#d5b7ff",
    "brightCyan": "#a0fff1",
    "brightWhite": "#ffffff"
  },
  "syntax": {
    "keyword": "#c396f5",
    "string": "#82cb92",
    "regexp": "#82cb92",
    "escape": "#82cb92",
    "special(string)": "#82cb92",
    "comment": {
      "color": "#9f9fa9",
      "italic": true
    },
    "processingInstruction": {
      "color": "#9f9fa9",
      "italic": true
    },
    "literal": "#eca760",
    "number": "#eca760",
    "bool": "#eca760",
    "null": "#eca760",
    "atom": "#eca760",
    "typeName": "#71d0d5",
    "className": "#71d0d5",
    "namespace": "#71d0d5",
    "propertyName": "#82b1ed",
    "tagName": "#82b1ed",
    "function(variableName)": "#82b1ed",
    "punctuation": "#9f9fa9",
    "operator": "#9f9fa9",
    "operatorKeyword": "#9f9fa9",
    "invalid": "#ff6467",
    "strong": {
      "bold": true
    },
    "heading": {
      "bold": true
    },
    "emphasis": {
      "italic": true
    },
    "link": {
      "underline": true
    },
    "strikethrough": {
      "strikethrough": true
    }
  }
}
